店舖名稱,店舖號,服務編號,地址,電話
全家鳳山文山店,014551,52136,高雄市鳳山區青年路二段460號一樓,"07-9741240, 07-7778107"
全家鳳山華興店,016557,18488,高雄市鳳山區南華路171號1樓,"07-9744366, 07-7260571"
全家鳳山南華店,017805,56601,高雄市鳳山區南華路83號,"07-9765351, 07-7277379"
全家鳳山善美店,017469,17931,高雄市鳳山區南榮路83號一樓,"07-9744365, 07-7160451"
全家鳳山海洋店,018157,17229,"高雄市鳳山區海洋一路127號,129號","07-9744377, 07-7666342"
全家鳳山興昌店,018722,50467,高雄市鳳山區國光路50號,"07-9744385, 07-7455277"
全家鳳山凱旋店,014465,17048,高雄市鳳山區凱旋路265號,"07-9744252, 07-7636049"
全家鳳山武營店,016239,17677,高雄市鳳山區凱旋路437號1樓,"07-9744376, 07-7671475"
全家鳳山新富店,016338,17069,高雄市鳳山區新富路398號1樓,"07-9741736, 07-7668853"
全家鳳山新強店,015303,18224,高雄市鳳山區新富路210號,"07-9744251, 07-7675827"
全家鳳山瑞興店,017052,17096,高雄市鳳山區瑞興路120號,"07-9744368, 07-7191407"
全家鳳山力行店,018631,18514,高雄市鳳山區經武路316號,"07-9744316, 07-7100523"
全家鳳山誠義店,011945,51945,高雄市鳳山區誠義路119號,"07-9765175, 07-7406564"
全家鳳山頂庄店,013743,53743,高雄市鳳山區過勇路111號,"07-9763905, 07-7925213"
全家鳳山鎮北店,018471,53615,高雄市鳳山區鳳北路63號1樓。2樓,"07-9766106, 07-7337069"
全家鳳山鳳彥店,018201,58201,高雄市鳳山區鳳甲路418號,"07-9721739, 07-7926356"
全家鳳山老爺店,016486,19386,高雄市鳳山區鳳南路19號,"07-9744372, 07-7170515"
全家鳳山教勤店,016369,56256,高雄市鳳山區鳳頂路1000號教勤營大樓,"07-9765575, 07-7408273"
全家鳳山金湯店,016370,56257,高雄市鳳山區鳳頂路1000號105大樓,"07-9765723, 07-7406140"
全家鳳山鳳庄店,018826,58826,高雄市鳳山區鳳頂路181號,"07-9765127, 07-7918768"
全家鳳山五甲店,018612,17211,高雄市鳳山區錦田路193號,"07-9744317, 07-8313940"
全家鳳山濱山店,018866,53489,高雄市鳳山區濱山街15巷2號,"07-9741960, 07-7779419"
全家大發中庄店,015306,18534,高雄市大寮區八德路32號,"07-9741737, 07-7031937"
全家大發開封店,017118,18118,高雄市大寮區大寮路630號632號1樓,"07-9741767, 07-7888382"
全家大發仁忠店,018858,58858,高雄市大寮區仁忠路103號,07-7874328
全家大發仁愛店,014480,51997,高雄市大寮區仁愛路22號,"07-9766746, 07-7012590"
全家大發輔大店,014761,18093,高雄市大寮區進學路151號,"07-7829196, 07-7833608"
全家大發輔大二店,014370,54370,高雄市大寮區進學路151號,07-7826753
全家大發萬翁店,017298,50006,高雄市大寮區萬丹路545號,"07-9741768, 07-7832602"
全家大發新發店,017492,57492,高雄市大寮區鳳林三路405號,"07-9765052, 07-7835368"
全家大發江山店,017861,57861,高雄市大寮區鳳屏二路46號,"07-9763367, 07-7019527"
全家林園文林店,011846,51846,高雄市林園區東林西路137號,"07-9741452, 07-6417056"
全家林園鑫園店,014835,54300,高雄市林園區林園北路439號一樓,"07-9765393, 07-6417592"
全家林園海洋店,018925,57493,高雄市林園區漁港路87號,"07-9765053, 07-6410558"
全家林園鳳林店,017418,18378,高雄市林園區鳳林路一段92號,"07-9744388, 07-6436091"
全家鳥松大仁店,018760,17916,高雄市鳥松區大仁南路1號一樓,"07-9769793, 07-7353830"
全家鳥松星光店,017649,54862,高雄市鳥松區大埤路123號一樓,"07-9769670, 07-7354577"
全家鳥松濱湖店,012015,12822,高雄市鳥松區文前路3巷21-1號,"07-9744310, 07-7352906"
全家鳥松觀湖店,018452,52338,高雄市鳥松區松埔北巷4-205號,"07-9766303, 07-7354728"
全家鳥松大華店,014550,52497,高雄市鳥松區球場路75號1樓,"07-9766240, 07-3709772"
全家鳥松仁美店,013586,53488,高雄市鳥松區學堂路91-1號,"07-9741953, 07-7333641"
全家大樹義城店,013801,18738,"高雄市大樹區學城路一段12號(商店街12,13號)","07-9741811, 07-6568076"
全家大樹鳳荔店,017806,50520,高雄市大樹區實踐路61號(一二三四間),"07-9741881, 07-6520498"
全家大樹義大一店,016487,17970,高雄市大樹區學城路一段1號(學生活動中心),"07-9741779, 07-6578913"
全家大樹水興店,016017,18737,高雄市大樹區中山路174號,"07-9741775, 07-6526780"
全家大樹義邦店,013802,14665,高雄市大樹區學城路一段12號Ｃ3F08,"07-9744390, 07-6568082"
全家大樹義大二店,016489,17971,高雄市大樹區學城路一段8巷2號地下1樓,"07-9769798, 07-6577938"
全家旗山車站店,014290,17451,高雄市旗山區大同街23號,"07-9765176, 07-6626300"
全家美濃泰安店,015113,55113,高雄市美濃區中正路一段53號,"07-9766881, 07-6812061"
全家美濃中興店,016063,50761,高雄市美濃區中興路一段819號,"07-9744320, 07-6816160"
全家六龜農會店,015157,55157,高雄市六龜區光復路109號,"07-9766980, 07-6891095"
全家內門羅漢門店,018575,58575,高雄市內門區南屏路235號(配送用),"07-9766405, 07-6672369"
全家杉林農會店,015948,55948,高雄市杉林區清水路45號,"07-9765352, 07-6774509"
全家茄萣民治店,016863,52137,高雄市茄萣區民治路101號1＆2＆3樓,"07-9769746, 07-6988573"
全家茄萣白砂崙店,014501,18370,高雄市茄萣區白砂路243號1樓,"07-9744222, 07-6903182"
